{
  "schemaVersion": 1,
  "eventId": "11111111-1111-4111-8111-111111111111",
  "sampleId": "22222222-2222-4222-8222-222222222222",
  "requestId": "fixture-request-1",
  "rolloutId": "33333333-3333-4333-8333-333333333333",
  "routeVersion": 7,
  "deploymentId": "baseline-v1",
  "outcome": "SUCCESS",
  "statusCode": 200,
  "latencyMs": 12,
  "observedAt": "2026-08-12T00:00:01Z"
}
